SBCode,Production Id,,Trigger approved,Initial Approved,Billing Budget History,Cost Budget History,Budget Approval Status
SB22249,10213,SB22249 Hero Nakshatra in Baku,TRUE,TRUE,11685140,11047704,Approved
SB22250,10214,SB22250 Cognizant Leadership Summit Udaipur,TRUE,TRUE,1493407.3,1234897,Approved
SB22251,10215,SB22251 Dell Gift delivery for PTC Door Openers India,TRUE,TRUE,1737450,1237500,Approved
SB22252,10216,SB22252 HUL - Prabhat Turns 11 2024,TRUE,TRUE,1600000,1104370.81,Approved
SB22253,10217,SB22253 OnePlus Media Drive in Sri Lanka,TRUE,TRUE,6127633,5032889.38,Approved
SB22254,10218,"SB22254 HPE Ignite in Athens, Greece",TRUE,TRUE,46500000,37620500,Approved
SB22255,10219,SB22255 cognizant AIA Event logistic,TRUE,TRUE,806058,740828,Approved
SB22256,10220,SB22256 Cognizant Musical evening - Hyderabad,TRUE,TRUE,1432519,1375471.99,Approved
SB22257,10221,SB22257 Adobe ABM activities,TRUE,TRUE,1685000,1263750,Approved
SB22258,10222,SB22258 Amazon SX-FCGT Meeting,TRUE,TRUE,695602,461623,Approved
SB22259,10223,SB22259 Cognizant FSI Strategy Meet,TRUE,TRUE,310750,241800,Approved
SB22260,10224,SB22260 Christmas Decor - Multiple Sites,TRUE,TRUE,99110,55000,Approved
SB22261,10225,SB22261 Cognizant Namma Mangaluru Beats,TRUE,TRUE,835796,702221,Approved
SB22262,10226,SB22262 DBS Bank - Future of Ops Festival,TRUE,TRUE,400400,261750,Approved
SB22263,10227,SB22263 Google YT Creator Collective Q1 & Q2 2025,TRUE,TRUE,19679990,14759992.5,Approved
SB22264,10228,SB22264 Red Hat Summit Connect 2024,TRUE,TRUE,1300000,975000,Approved
SB22265,10229,SB22265 Nordisk EDM,TRUE,TRUE,11000,8250,Approved
SB22266,10230,SB22266 GitHub Tech after dark Marquis,TRUE,TRUE,1829275,1162600,Approved
SB22267,10231,SB22267 OnePlus Dealer Meet,TRUE,TRUE,9458093,7431040.27,Approved
SB22268,10232,SB22268 Hitachi Idea Cafe CIO events - Feb 2025,TRUE,TRUE,3411474,2100000,Approved
SB22269,10233,SB22269 Herbalife FIT FAMILIES FEST 2025,TRUE,TRUE,11299417,3640000,Approved
SB22270,10234,SB22270 Brookfield Properties Powai Run At Powai,TRUE,TRUE,3731486,2798614.5,Approved
SB22271,10235,SB22271 NXP Stall at VLSID Conference At Bangalore,TRUE,TRUE,468214,351160.5,Approved
SB22272,10236,SB22272 BYD Auto Expo 2025 @ Pragti Maidan,TRUE,TRUE,38283592,28712694,Approved
SB22273,10237,SB22273 Towards India & Saarc Partner Summit event Execution @ Mumbai,TRUE,TRUE,2100263,1575197.25,Approved
SB22274,10238,SB22274 Cognizant Permanent Setup @ Hyderabad,TRUE,TRUE,163680,122760,Approved
SB22275,10239,SB22275 Star Health - SS Launch @ Bangalore,TRUE,TRUE,15660,11745,Approved
SB22276,10240,SB22276 ITC Conquest Giveaway @ Bangalore,TRUE,TRUE,81840,61380,Approved
SB22277,10241,SB22277 Adobe Elite Circle At Gurgaon,TRUE,TRUE,3234784,2426088,Approved
SB22278,10242,SB22278 Delta Elecrama 2025 at Noida,TRUE,TRUE,14527205,10895403.75,Approved
SB22279,10243,SB22279 OnePlus event & SAP Giveaways at Delhi,TRUE,TRUE,380600,285450,Approved
SB22280,10244,SB22280 Cognizant Cultural Event @ Multicity,TRUE,TRUE,1451280,1088460,Approved
SB22281,10245,SB22281 Ki Mobility myTVS A@ Yashobhoomi,TRUE,TRUE,3420956,2565717,Approved
SB22282,10246,SB22282 Amazone  IESP,TRUE,TRUE,354542,265906.5,Approved
SB22283,10247,SB22283 TVS Supply Chain Solution - TS Rajam Award,TRUE,TRUE,10450,7837.5,Approved
SB22284,10248,SB22284 TVS Srichakra for Shiprocket,TRUE,TRUE,21500,16125,Approved
SB22285,10249,SB22285 Regency Ceramics Booth at Naredco Exhibition,TRUE,TRUE,657481,493110.75,Approved
SB22286,10250,SB22286 Siemens MO for T-shirt & Acrylic badge,TRUE,TRUE,25107,18830.25,Approved
SB22287,10251,SB22287 Siemens_ Customer Visit - Inauguration At Airoli,TRUE,TRUE,47183,35387.25,Approved
SB22288,10252,SB22288 OnePlus Jam Night @ IIT Madras,TRUE,TRUE,655930,491947.5,Approved
SB22289,10253,SB22289 SAP ALM Summit 2025,TRUE,TRUE,781000,585750,Approved
SB22290,10254,SB22290 Redington Data Profiling,TRUE,TRUE,570000,427500,Approved
SB22291,10255,SB22291 Siemens Walkathon 2025,TRUE,TRUE,873856,655392,Approved
SB22292,10256,SB22292 Amazone Photographer Arrangemen,TRUE,TRUE,9350,7012.5,Approved
SB22293,10257,SB22293 Aisle Experience,TRUE,TRUE,239424,179568,Approved
SB22294,10258,SB22294 Cognizant Metal Badges,TRUE,TRUE,17462,13096.5,Approved
SB22295,10259,SB22295 Accenture   CBRE Client visit,TRUE,TRUE,525937.5,394453.13,Approved
SB22296,10260,SB22296 Lakme Stall at Mithibai Fest,TRUE,TRUE,300000,225000,Approved
SB22297,10261,SB22297 YouTube Execs Meet up at Soho House Mumbai,TRUE,TRUE,622248,466686,Approved
SB22298,10262,SB22298 LogiMAT India 2025,TRUE,TRUE,300000,225000,Approved
SB22299,10263,SB22299 Cognizant Invesco Client Visit Badge,TRUE,TRUE,29920,22440,Approved
SB22300,10264,SB22300 Siemens Energy Townhall Event,TRUE,TRUE,300782,225586.5,Approved
SB22301,10265,SB22301 Redington NetApp Partner Roundtable,TRUE,TRUE,838980,629235,Approved
SB22302,10266,SB22302 Siemens SEIL : GST Registration,TRUE,TRUE,230844,173133,Approved
SB22303,10267,SB22303 Lenovo EBC Tour,TRUE,TRUE,6182956,4637217,Approved
SB22304,10268,SB22304 Siemens IMTEX 2025,TRUE,TRUE,286691,215018.25,Approved
SB22305,10269,SB22305 Dell CSG Launch on 9th April in Andaz New Delhi,TRUE,TRUE,1650000,1237500,Approved
SB22306,10270,SB22306 Dell ISG Launch 13th to 19th March,TRUE,TRUE,2000000,1500000,Approved
SB22307,10271,SB22307 Vmware Tanzu Giveaways,TRUE,TRUE,739200,554400,Approved
SB22308,10272,SB22308 OnePlus Podium Delivery at 6 stores,TRUE,TRUE,2098426,1573819.5,Approved
SB22309,10273,SB22309 Ncpa Concert Delhi,TRUE,TRUE,1926850,1445137.5,Approved
SB22310,10274,SB22310 Cognizant Alkem Laboratories Client Visit,TRUE,TRUE,70719,53039.25,Approved
SB22311,10275,SB22311 Perno store promotion installation,TRUE,TRUE,252845,189633.75,Approved
SB22312,10276,SB22312 Exclusive Lotus Showroom Launch,TRUE,TRUE,738925,554193.75,Approved
SB22313,10277,SB22313 Autodesk IMTEX 2025,TRUE,TRUE,2271500,1703625,Approved
SB22314,10278,SB22314 Siemens EA Awards 2025,TRUE,TRUE,477104,357828,Approved
SB22315,10279,SB22315 Adobe ALM Gifting in Feb 2025,TRUE,TRUE,507136,380352,Approved
SB22316,10280,SB22316 Infosys event & Giveaways in Feb 2025,TRUE,TRUE,1250000,937500,Approved
SB22317,10281,SB22317 VCF Experience Day,TRUE,TRUE,1550000,1162500,Approved
SB22318,10282,SB22318 Dell WPC & AI events in Feb 2025,TRUE,TRUE,9900000,7425000,Approved
SB22319,10283,SB22319 Dell WPC events in March 2025,TRUE,TRUE,6600000,4950000,Approved
SB22320,10284,SB22320 Dell AI & Innovation Forum events,TRUE,TRUE,3300000,2475000,Approved
SB22321,10285,SB22321 Q4 Webinar Registration,TRUE,TRUE,516000,387000,Approved
SB22322,10286,SB22322 HPE Team Event – FY25 Planning,TRUE,TRUE,550000,412500,Approved
SB22323,10287,SB22323 Tele Lead Gen Campaign - Dragonfly accounts,TRUE,TRUE,820000,615000,Approved
SB22324,10288,SB22324 Hul Board Meeting 2025,TRUE,TRUE,6684335,5013251.25,Approved
SB22326,10289,SB22326 Red Hat Tech Talks Series,TRUE,TRUE,3391394,2543545.5,Approved
SB22327,10290,SB22327 Siemens Healthineers DC,TRUE,TRUE,8557172,6417879,Approved
SB22328,10291,SB22328 Next Leap CHRO event,TRUE,TRUE,2178877,1634157.75,Approved
SB22329,10292,SB22329 Sleepwell's Founders Day,TRUE,TRUE,5156545,3867408.75,Approved
SB22330,10293,SB22330 OnePlus Snapshot masterclass,TRUE,TRUE,1162561,871920.75,Approved
SB22331,10294,SB22331 Intel F2F Leadership meet 2025,TRUE,TRUE,2063730,1547797.5,Approved
SB22332,10295,SB22332 Singapore GIC 15th Anniversary Celebration,TRUE,TRUE,4644563,3483422.25,Approved
SB22333,10296,SB22333 DBS Podcast with Taimur Event,TRUE,TRUE,98450,73837.5,Approved
SB22334,10297,SB22334 HUL - Taj Tea Stall,TRUE,TRUE,189796,142347,Approved
SB22335,10298,SB22335 Brookfields Waterstones,TRUE,TRUE,1995312,1496484,Approved
SB22336,10299,SB22336 Madras Music Academy,TRUE,TRUE,713927,535445.25,Approved
SB22337,10300,SB22337 Glaxo Farewell Video for Raj,TRUE,TRUE,60500,45375,Approved
SB22338,10301,SB22338 SAP Invent 3.0,TRUE,TRUE,711172,533379,Approved
SB22339,10302,SB22339 Accenture Legal Learning Lab,TRUE,TRUE,96668,72501,Approved
SB22340,10303,SB22340 KORA food Street Display Activity,TRUE,TRUE,184989,138741.75,Approved
SB22341,10304,SB22341 Modiway Launch event,TRUE,TRUE,8761500,6571125,Approved
SB22342,10305,SB22342 Accenture Can Do Awards,TRUE,TRUE,1169339,877004.25,Approved
SB22343,10306,SB22343 OnePlus Pop-up,TRUE,TRUE,13000000,9750000,Approved
SB22344,10307,SB22344 GitHub Galaxy 2025,TRUE,TRUE,10000000,7500000,Approved
SB22345,10308,SB22345 IHCL STAR Awards 2024,TRUE,TRUE,4169000,3126750,Approved
SB22346,10309,SB22346 Platinum Sponsor for BTOPEX India,TRUE,TRUE,1320000,990000,Approved
SB22347,10310,SB22347 Orica Kshitej,TRUE,TRUE,4216259,3162194.25,Approved
SB22348,10311,SB22348 Accenture Manufacturing Futurecast,TRUE,TRUE,918258,688693.5,Approved
SB22349,10312,SB22349 Tata Advanced Systems - Memento Order,TRUE,TRUE,69575,52181.25,Approved
SB22350,10313,SB22350 HUL - Novology Booth at Dermacon 2025,TRUE,TRUE,5700687,4275515.25,Approved
SB22351,10314,SB22351 HUL - Growth Leaders Forum,TRUE,TRUE,650283,487712.25,Approved
SB22352,10315,SB22352 DBS Piyush Gupta Farewell,TRUE,TRUE,599940,449955,Approved
SB22353,10316,SB22353 HUL Kissan Meeting 2025,TRUE,TRUE,495000,371250,Approved
SB22354,10317,SB22354 HUL PC Summit,TRUE,TRUE,3543710,2657782.5,Approved
SB22355,10318,SB22355 Siemens Mobility Meet 2025,TRUE,TRUE,722787,542090.25,Approved
SB22356,10319,SB22356 RNTBCi Innovfest 25,TRUE,TRUE,763077,572307.75,Approved
SB22357,10320,SB22357 KNMA Legacy Series,TRUE,TRUE,826100,619575,Approved
SB22358,10321,SB22358 HPE Wipro partner day,TRUE,TRUE,849970,637477.5,Approved
SB22359,10322,SB22359 Amazon Brand Film Amplification Plan,TRUE,TRUE,695800,521850,Approved
SB22360,10323,SB22360 Citi Bank giveaways,TRUE,TRUE,49500,37125,Approved
SB22361,10324,"SB22361  IKEA - Feb & Mar Activity from 7th Feb to 30th March 2025,",TRUE,TRUE,3091000,2318250,Approved
SB22362,10325,SB22362 Amazon SPS Fire Side Chat,TRUE,TRUE,68068,51051,Approved
SB22363,10326,SB22363 BIAL V day installations,TRUE,TRUE,1809005,1356753.75,Approved
SB22364,10327,SB22364 Microsoft townhall @ MS Office Gurgaon,TRUE,TRUE,721000,540750,Approved
SB22365,10328,SB22365 Siemens CS Global Workshop,TRUE,TRUE,64258,48193.5,Approved
SB22366,10329,SB22366 NatWest Ruchika Panesar Town Hall Meet,TRUE,TRUE,328969,246726.75,Approved
SB22367,10330,SB22367 Hitachi Yes Bank Tech Workshop Nashik,TRUE,TRUE,1000000,750000,Approved
SB22368,10331,SB22368 Hul R&D Mumbai,TRUE,TRUE,2111798,1583848.5,Approved
SB22369,10332,SB22369 Siemens Energy Office branding,TRUE,TRUE,427650,320737.5,Approved
SB22370,10333,SB22370 Accenture  Navigating caregiving – Diverse journeys and expert perspective,TRUE,TRUE,434500,325875,Approved
SB22371,10334,SB22371 Cognizant CMD Town Hall Meet 2025,TRUE,TRUE,124960,93720,Approved
SB22372,10335,SB22372 Itc Learnify Booth,TRUE,TRUE,100787,75590.25,Approved
SB22373,10336,SB22373 Audi RSQ8 Launch event,TRUE,TRUE,4189907,3142430.25,Approved
SB22374,10337,SB22374 Intel Laptop storage space,TRUE,TRUE,1591200,1193400,Approved
SB22375,10338,SB22375 Siemens locomotive model,TRUE,TRUE,292462,219346.5,Approved
SB22376,10339,SB22376 Ascension Health Client Visit,TRUE,TRUE,363214,272410.5,Approved
SB22377,10340,SB22377 INGKA - Hej Day,TRUE,TRUE,1311552,983664,Approved
SB22378,10341,SB22378 Ola Roadster Launch,TRUE,TRUE,850049,637536.75,Approved
SB22379,10342,SB22379 TATA Ethics & Affirmative Action Summit 2025,TRUE,TRUE,2041248,1530936,Approved
SB22380,10343,SB22380 Aisle Valentines Day,TRUE,TRUE,313174,234880.5,Approved
SB22381,10344,SB22381 Amway Star Awards,TRUE,TRUE,1500000,1125000,Approved
SB22382,10345,SB22382 TATA Legal Meet,TRUE,TRUE,3526391,2644793.25,Approved
SB22383,10346,SB22383 Hul Pukka event,TRUE,TRUE,1000000,750000,Approved
SB22385,10347,SB22385 GitHub Wipro Connect,TRUE,TRUE,346580,259935,Approved
SB22386,10348,SB22386 HUL West Branch Connect 2025,TRUE,TRUE,2682808,2012106,Approved
SB22387,10349,SB22387 Hul CD conference 2025,TRUE,TRUE,5671000,4253250,Approved
SB22388,10350,SB22388 Siemens SSP Launch,TRUE,TRUE,1342236,1006677,Approved
SB22389,10351,SB22389 Cognizant Crescendo,TRUE,TRUE,8887714,6665785.5,Approved
SB22390,10352,SB22390 Captain fresh IPO kick-off event,TRUE,TRUE,885811,664358.25,Approved
SB22391,10353,SB22391 Siemens - SRE Event,TRUE,TRUE,25157,18867.75,Approved
SB22392,10354,SB22392 Lightspeed - Lift Off 2025,TRUE,TRUE,7769834,5827375.5,Approved
SB22393,10355,SB22393 Siemens GBS Townhall Event,TRUE,TRUE,452837,339627.75,Approved
SB22394,10356,SB22394 Siemens Veronika Townhall  2025,TRUE,TRUE,322650,241987.5,Approved
SB22395,10357,SB22395 Hul Cornetto Stall at Zomaland,TRUE,TRUE,5001282,3750961.5,Approved
SB22396,10358,SB22396 Dell CSG Launch event,TRUE,TRUE,2100000,1575000,Approved
SB22397,10359,SB22397 Intel Cab and Bus for GPTW,TRUE,TRUE,715823,536867.25,Approved
SB22398,10360,SB22398 HUL - B&W Walkthrough,TRUE,TRUE,1801782,1351336.5,Approved
SB22399,10361,SB22399 Autodesk Design & Manufacturing Summit 2025,TRUE,TRUE,2806680,2105010,Approved
SB22400,10362,SB22400 RHEL + Ansible Workshop,TRUE,TRUE,3290000,2467500,Approved
SB22401,10363,"SB22401 Elecrama ieema, WUS Dinner,",TRUE,TRUE,1850000,1387500,Approved
SB22402,10364,SB22402 Accenture Duke Energy Client Visit Pune,TRUE,TRUE,244750,183562.5,Approved
SB22403,10365,SB22403 Amazone Stamp Purchase,TRUE,TRUE,20000,15000,Approved
SB22404,10366,SB22404 GitHub Connect in Chennai,TRUE,TRUE,263913,197934.75,Approved
SB22405,10367,SB22405 Amway Diamond Forum,TRUE,TRUE,5000000,3750000,Approved
SB22406,10368,SB22406 siemens Advanta Rainer,TRUE,TRUE,198423,148817.25,Approved
SB22407,10369,SB22407 Tvs Sub Dealer Meet,TRUE,TRUE,58131,43598.25,Approved
SB22408,10370,SB22408 Cognizant Acrylic Name Badge,TRUE,TRUE,9350,7012.5,Approved
SB22409,10371,SB22409 Towards Workshop - Bangalore & Mumbai,TRUE,TRUE,343114,257335.5,Approved
SB22410,10372,SB22410 CNBC x HUL - Lime Season,TRUE,TRUE,1673113,1254834.75,Approved
SB22411,10373,SB22411 Amazon Insurgents & EBE - Summit,TRUE,TRUE,194464,145848,Approved
SB22412,10374,SB22412 Amazon EBE Summit,TRUE,TRUE,194464,145848,Approved
SB22413,10375,SB22413 HUL advantage Assam 2.0,TRUE,TRUE,6084041,4563030.75,Approved
SB22414,10376,SB22414 Adobe MakeIT,TRUE,TRUE,8194780,6146085,Approved
SB22415,10377,SB22415 Adfactors Celebrating the Success of Initial Public Offer,TRUE,TRUE,272338,204253.5,Approved
SB22416,10378,SB22416 DBS Bank IBG Townhall 2025,TRUE,TRUE,278300,208725,Approved
SB22417,10379,SB22417 Brookprpo ESG REPORT LAUNCH,TRUE,TRUE,1503942,1127956.5,Approved
SB22418,10380,SB22418 Towards Graph Summit,TRUE,TRUE,838179,628634.25,Approved
SB22419,10381,SB22419  TVS Srichakra _Eurogrip Petrol Pump Activity & IT Park Activity,TRUE,TRUE,62162,46621.5,Approved
SB22421,10382,SB22421 Accenture Moview Tickets,TRUE,TRUE,624250,468187.5,Approved
SB22423,10383,SB22423 HUL - Liquid IV Recovery Party,TRUE,TRUE,870931,653198.25,Approved
SB22424,10384,SB22424 Cognizant Impact Awards 2025,TRUE,TRUE,4479045,3359283.75,Approved
SB22425,10385,SB22425 Cognizant Hartford - Noida Facility,TRUE,TRUE,1019799,764849.25,Approved
SB22426,10386,SB22426 Cognizant Townhall Setup,TRUE,TRUE,229636,172227,Approved
SB22427,10387,SB22427 Cognizant Suncorp Visit Pune,TRUE,TRUE,242935,182201.25,Approved
SB22428,10388,"SB22428 SAP Industry Summit at Westin, Powai",TRUE,TRUE,3412500,2559375,Approved
SB22429,10389,SB22429 Intel  Premium standee print,TRUE,TRUE,70875,53156.25,Approved
SB22430,10390,SB22430 Cellvest Launch,TRUE,TRUE,790956,593217,Approved
SB22431,10391,SB22431 Intel AIPC Workshop at ECO Training,TRUE,TRUE,586740,440055,Approved
SB22432,10392,SB22432 NCPA CONCERT,TRUE,TRUE,890340,667755,Approved
SB22433,10393,SB22433 SOFTCELL Netapp Event,TRUE,TRUE,317178,237883.5,Approved
SB22434,10394,SB22434 Amazon - LAT,TRUE,TRUE,207932,155949,Approved
SB22435,10395,SB22435 Tvs Shiprocket,TRUE,TRUE,21500,16125,Approved
SB22436,10396,SB22436 Adobe India Leadership Connect,TRUE,TRUE,840000,630000,Approved
SB22437,10397,SB22437 Aptra India Conference 2025,TRUE,TRUE,5130720,3848040,Approved
SB22438,10398,SB22438 Netapp V5 Techsol Customer Event,TRUE,TRUE,593505,445128.75,Approved
SB22439,10399,SB22439 Red Hat Q1 Tech Webinar Series,TRUE,TRUE,1232800,924600,Approved
SB22440,10400,SB22440 Star India Kannada Screening,TRUE,TRUE,618622,463966.5,Approved
SB22441,10401,SB22441 SAP Booth at NTLF 2025,TRUE,TRUE,181060,135795,Approved
SB22442,10402,"SB22442 IKEA - RAI Stall,",TRUE,TRUE,553875,415406.25,Approved
SB22443,10403,SB22443 THOUGHTWORKS BOOTH at the NASSCOM event,TRUE,TRUE,231000,173250,Approved
SB22444,10404,SB22444 CIO Netskope_CIOKlub event,TRUE,TRUE,498978,374233.5,Approved
SB22445,10405,SB22445 Tvs RRC & MMC SOUTH,TRUE,TRUE,37856,28392,Approved
SB22446,10406,SB22446 Cognizant MACY'S Client Visit,TRUE,TRUE,1460800,1095600,Approved
SB22447,10407,SB22447 Neo4J Swags with arrangements,TRUE,TRUE,23920,17940,Approved
SB22448,10408,SB22448 Adobe Make it,TRUE,TRUE,928816,696612,Approved
SB22449,10409,SB22449 Siemens Digital Kiosk,TRUE,TRUE,399072,299304,Approved
SB22450,10410,SB22450 SAP Build Day,TRUE,TRUE,75038,56278.5,Approved
SB22451,10411,SB22451 Phonepe Converge,TRUE,TRUE,794847,596135.25,Approved
SB22452,10412,SB22452 INPG Pinnacle R&R,TRUE,TRUE,1683242,1262431.5,Approved
SB22453,10413,SB22453 Indoor Showroom Inauguration,TRUE,TRUE,326469,244851.75,Approved
SB22454,10414,SB22454 Amazon - LML,TRUE,TRUE,349299,261974.25,Approved
SB22456,10416,SB22456 DBS Bank - DBS Technology Roadshow,TRUE,TRUE,440000,330000,Approved
SB22457,10417,SB22457 Cognizant Gurgaon Client Visit,TRUE,TRUE,14726,11044.5,Approved
SB22458,10418,SB22458 DBS CEO Give Away,TRUE,TRUE,234230,175672.5,Approved
SB22460,10419,SB22460 HMI Townhall Event 2025,TRUE,TRUE,872600,654450,Approved
SB22461,10420,SB22461 Holi 2025 : Pan India Celebration,TRUE,TRUE,14685862,11014396.5,Approved
SB22462,10421,SB22462 Siemens DEI Tree Making,TRUE,TRUE,130048,97536,Approved
SB22463,10422,SB22463 Cognizant NLG Client Visit,TRUE,TRUE,104467,78350.25,Approved
SB22464,10423,SB22464 Natwest Nicola Town Hall Meet,TRUE,TRUE,396201,297150.75,Approved
SB22465,10424,SB22465 HUL CEO Review,TRUE,TRUE,10000000,7500000,Approved
SB22466,10425,SB22466 Shella Kurlon Business Meet,TRUE,TRUE,720500,540375,Approved
SB22467,10426,SB22467 Cognizant EDJ Client visit.,TRUE,TRUE,145000,108750,Approved
SB22468,10427,SB22468 Cognizant Nation Wide.,TRUE,TRUE,250000,187500,Approved
SB22469,10428,SB22469 Cognizant RBC Client Visit 2025,TRUE,TRUE,3288648,2466486,Approved
SB22470,10429,SB22470 Novo Nordisk Townhall,TRUE,TRUE,818918,614188.5,Approved
SB22471,10430,SB22471 BIAL Partner Connect 6.0,TRUE,TRUE,4610589,3457941.75,Approved
SB22475,10431,SB22475 Hero International Women's Day,TRUE,TRUE,9039371,6779528.25,Approved
SB22477,10432,SB22477 Google YT Shopping X Tech,TRUE,TRUE,4100036,3075027,Approved
SB22478,10433,SB22478 Signify Plaque and Certificates,TRUE,TRUE,222880,167160,Approved
SB22479,10434,"SB22479 Brookfield IPC Event,",TRUE,TRUE,3554369,2665776.75,Approved
SB22480,10435,SB22480 DBS Piyush Gupta Farewell Photographer,TRUE,TRUE,8800,6600,Approved
SB21466,10619,SB21466 TVS Event at Sheraton Grand White field,TRUE,TRUE,1000000,0,Approved
SB21942,10620,SB21942 Regency AV Production,TRUE,TRUE,995500,450000,Approved
SB22325,10622,SB22325 Infosys legal service delivery sessions,TRUE,TRUE,627473,470604.75,Approved
SB22481,10623,SB22481 Eicher Womens Day activation,TRUE,TRUE,94656,70992,Approved
SB22482,10624,SB22482 Eurogrip RRC Activity FEB 2025,TRUE,TRUE,15499,11624.25,Approved
SB22483,10625,SB22483 Hero Xoom Media Drive,TRUE,TRUE,2475151,1856363.25,Approved
SB22484,10626,SB22484 DBS T&O Townhall,TRUE,TRUE,385550,289162.5,Approved
SB22486,10627,SB22486 Siemens Townhall,TRUE,TRUE,225881,169410.75,Approved
SB22487,10628,SB22487 Amazon Holi Event,TRUE,TRUE,309188,231891,Approved
SB22488,10629,SB22488 NetApp_CrossGen_RIL_Kochi_eventCustomer Event,TRUE,TRUE,339093,254319.75,Approved
SB22489,10630,SB22489 Amazon OTS Townhall Meeting.,TRUE,TRUE,34496,25872,Approved
SB22490,10631,SB22490 DBS Sun board Printings,TRUE,TRUE,15510,11632.5,Approved
SB22491,10632,SB22491 Hul  Magnum x LFW,TRUE,TRUE,3769198,2826898.5,Approved
SB22492,10633,SB22492 DBS Badminton Players  Meet & Greet,TRUE,TRUE,1000010,750007.5,Approved
SB22493,10634,SB22493 DBS Virtual Photobooth,TRUE,TRUE,18150,13612.5,Approved
SB22494,10635,SB22494 Siemens GBS Townhall,TRUE,TRUE,518818,389113.5,Approved
SB22495,10636,SB22495 HUL SC Conference 2025,TRUE,TRUE,11723444,8792583,Approved
SB22496,10637,SB22496 HUL MacBook Purchas,TRUE,TRUE,253237,189927.75,Approved
SB22497,10638,SB22497 Hul JBP Meet 2025,TRUE,TRUE,246100,184575,Approved
SB22498,10639,SB22498 OnePlus SFS pop-up,TRUE,TRUE,355246,266434.5,Approved
SB22499,10640,SB22499 OnePlus Jamnight @ IIT DTU,TRUE,TRUE,335929,251946.75,Approved
SB22500,10641,SB22500 Tata Motors Stealth Mall Activation,TRUE,TRUE,10882960,8162220,Approved
SB22501,10642,SB22501 Siemens MO Townhall,TRUE,TRUE,665782,499336.5,Approved
SB22502,10643,SB22502 Siemens Elevate at Siemens Office,TRUE,TRUE,2070754,1553065.5,Approved
SB22503,10644,SB22503 HUL North Branch Meet 2025,TRUE,TRUE,1679396,1259547,Approved
SB22504,10645,SB22504 Amazon - AA Leadership Connect,TRUE,TRUE,143693,107769.75,Approved
SB22505,10646,SB22505 Jio with arrangements,TRUE,TRUE,224000,168000,Approved
SB22506,10647,SB22506 DBS India Townhall Q1 2025,TRUE,TRUE,245000,183750,Approved
SB22507,10648,SB22507 Intel Premium standee delivered,TRUE,TRUE,150150,112612.5,Approved
SB22508,10649,SB22508 Intel AIPC Workshop,TRUE,TRUE,293370,220027.5,Approved
SB22510,10650,SB22510 Siemens Townhall,TRUE,TRUE,283345,212508.75,Approved
SB22511,10651,SB22511 Accenture  Interns Welcome Networking Dinner,TRUE,TRUE,1230768,923076,Approved
SB22512,10652,SB22512 Nvidia 2025,TRUE,TRUE,5000000,3750000,Approved
SB22513,10653,SB22513 VCF Experience Days and VMUG,TRUE,TRUE,1480113.6,1110085.2,Approved
SB22514,10654,SB22514 Accenture RSA Super Star Awards,TRUE,TRUE,117665,88248.75,Approved
SB22515,10655,SB22515 Acrylic Name Badge Pune Visit,TRUE,TRUE,9350,7012.5,Approved
SB22516,10656,SB22516 Accenture IHG Client Visit,TRUE,TRUE,176412.5,132309.38,Approved
SB22517,10657,SB22517 Hitachi CIO Klub Chennai chapter event,TRUE,TRUE,1200000,900000,Approved
SB22518,10658,SB22518 TATA debossed diaries & pens,TRUE,TRUE,17248,12936,Approved
SB22519,10659,SB22519 TATA debossed Logo Installation,TRUE,TRUE,111440,83580,Approved
SB22520,10660,SB22520 Towards Workshop - Delhi,TRUE,TRUE,197144,147858,Approved
SB22521,10661,SB22521 Hul Indulekha - Good Hair Day,TRUE,TRUE,350000,262500,Approved
SB22523,10662,SB22523 RNTBCI Cohort 2 Start Up Pitch awards,TRUE,TRUE,186450,139837.5,Approved
SB22524,10663,SB22524 Amazon - eCF Leadership 2025,TRUE,TRUE,125818,94363.5,Approved
SB22525,10664,SB22525 GlaxoSmithKline Certificates & Trophies,TRUE,TRUE,27830,20872.5,Approved
SB22526,10665,SB22526 Accenture International Women's Day 2025,TRUE,TRUE,134992,101244,Approved
SB22527,10666,SB22527 GitHub connect - Razorpay in Bangalore,TRUE,TRUE,284211,213158.25,Approved
SB22528,10667,SB22528 Microsoft townhall,TRUE,TRUE,392265,294198.75,Approved
SB22529,10668,SB22529 Cognizant Allianz Client Visit,TRUE,TRUE,570251,427688.25,Approved
SB22532,10669,SB22532 Natwest Logistics Town Hall Meet,TRUE,TRUE,337700,253275,Approved
SB22533,10670,SB22533 Amazon trifold Posters,TRUE,TRUE,32450,24337.5,Approved
SB22534,10671,SB22534 Cognizant US Bank Client Visit,TRUE,TRUE,169477,127107.75,Approved
SB22535,10672,SB22535 Cognizant US Bank Client Visit,TRUE,TRUE,190960,143220,Approved
SB22536,10673,SB22536 Citi Bank - Photographer,TRUE,TRUE,11000,8250,Approved
SB22537,10674,SB22537 Siemens Dahod Ministry Visit,TRUE,TRUE,433026,324769.5,Approved
SB22538,10675,SB22538 Mahindra GSO Offsite Decor,TRUE,TRUE,63910,47932.5,Approved
SB22539,10676,SB22539 Amway Doug DeVos India Leadership Summit,TRUE,TRUE,5000000,3750000,Approved
SB22540,10677,SB22540 SAP NOW 2025,TRUE,TRUE,23878565,17908923.75,Approved
SB22541,10678,SB22541 Networking Event @ IPL Chinnaswamy Stadium,TRUE,TRUE,2001000,1500750,Approved
SB22542,10679,SB22542 Confluent Booklet Printing,TRUE,TRUE,120750,90562.5,Approved
SB22543,10680,SB22543 BROOKFIELD POWAI - CUSTOMER EXPERIENCE JOURNEY,TRUE,TRUE,1448283,1086212.25,Approved
SB22544,10681,SB22544 Intel GPTW activities,TRUE,TRUE,35962,26971.5,Approved
SB22545,10682,SB22545 Hitachi SKO 25,TRUE,TRUE,3500020,2625015,Approved
SB22546,10683,SB22546 Cognizant Computershare Client Visit,TRUE,TRUE,571307,428480.25,Approved
SB22547,10684,SB22547 Amazon Booth - Soul Sante,TRUE,TRUE,73590,55192.5,Approved
SB22548,10685,SB22548 LSIP - Pickleball Tournament,TRUE,TRUE,581460,436095,Approved
SB22549,10686,SB22549 Siemens CEO Townhall Event,TRUE,TRUE,286859,215144.25,Approved
SB22550,10687,SB22550 Metro Cash & Carry - Annual Meet,TRUE,TRUE,2117334,1588000.5,Approved
SB22551,10688,SB22551 OnePlus pop-up,TRUE,TRUE,699894,524920.5,Approved
SB22552,10689,SB22552 Hul  Grat Fest 2025,TRUE,TRUE,1864118,1398088.5,Approved
SB22553,10690,SB22553 Siemens SRE Townhall,TRUE,TRUE,399644,299733,Approved
SB22554,10691,SB22554 GOC - Backdrop Installation,TRUE,TRUE,16100,12075,Approved
SB22555,10692,SB22555 Amazon AFBP Graduation Ceremony,TRUE,TRUE,137198,102898.5,Approved
SB22556,10693,SB22556 Amazon Smart Wallet Launch,TRUE,TRUE,72400,54300,Approved
SB22557,10694,SB22557 OnePlus Jam Night in Delhi,TRUE,TRUE,629684,472263,Approved
SB22558,10695,SB22558 Cognizant Nationwide Client Visit,TRUE,TRUE,215490,161617.5,Approved
SB22559,10696,SB22559 HPE Cloud Connect,TRUE,TRUE,2150500,1612875,Approved
SB22560,10697,SB22560 HPE Aruba Networking Day,TRUE,TRUE,1020000,765000,Approved
SB22561,10698,"SB22561 Dell - Indian Express events in May - 21, 22, 28 & 30th May",TRUE,TRUE,10000000,7500000,Approved
SB22562,10699,"SB22562 Dell - Indian Express events in June - 4, 12 & 18th June.",TRUE,TRUE,10000000,7500000,Approved
