SBCode,Production Id,,Trigger approved,Initial Approved,Billing Budget History,Cost Budget History,Budget Approval Status
SB22563,10700,"SB22563 Dell - Indian Express events in July - 2, 9 & 16th July",TRUE,TRUE,10000000,7500000,Approved
SB22564,10701,SB22564 BP India LT Dinner,TRUE,TRUE,1017327,762995.25,Approved
SB22565,10702,SB22565 Apparel Fashion Tech World,TRUE,TRUE,1643862,1232896.5,Approved
SB22566,10703,SB22566 HUL MT Conference 2025,TRUE,TRUE,3471250,2603437.5,Approved
SB22567,10704,SB22567 DBS Plasma Installation,TRUE,TRUE,22440,16830,Approved
SB22568,10705,SB22568 Tata Motors Investor Day 2025,TRUE,TRUE,1523500,1142625,Approved
SB22569,10706,SB22569 Vivo V50e in Mumbai,TRUE,TRUE,11153280,8364960,Approved
SB22570,10707,SB22570 Accenture Photographer Requirement - Multi City,TRUE,TRUE,171600,128700,Approved
SB22571,10708,SB22571 Intel Booth at Start Up Mahakumbh,TRUE,TRUE,2779112,2084334,Approved
SB22572,10709,SB22572 Team Bonding - Astrazeneca,TRUE,TRUE,94072,70554,Approved
SB22573,10710,SB22573 Amazon Townhall Meeting,TRUE,TRUE,33583,25187.25,Approved
SB22574,10711,SB22574 OnePlus OEF,TRUE,TRUE,1711179,1283384.25,Approved
SB22575,10712,SB22575 BP All India Townhall 2025,TRUE,TRUE,835524,626643,Approved
SB22576,10713,SB22576 RNTBCI Gemba visit,TRUE,TRUE,820930,615697.5,Approved
SB22577,10714,SB22577 Hero DIC Zonal Meet,TRUE,TRUE,3460086,2595064.5,Approved
SB22578,10715,SB22578 Siemens Switch board Factory 50 years,TRUE,TRUE,5333936,4000452,Approved
SB22580,10716,SB22580 Towards CIO Roundtable in Bangalore,TRUE,TRUE,650000,487500,Approved
SB22581,10717,#N/A,TRUE,TRUE,655500,491625,Approved
SB22582,10718,SB22582 BP Exploration,TRUE,TRUE,138448,103836,Approved
SB22583,10719,SB22583 DBS Webinar session with Navneet Munot,TRUE,TRUE,55000,41250,Approved
SB22584,10720,SB22584 Asus P series Launch,TRUE,TRUE,2600192,1950144,Approved
SB22585,10721,SB22585 Tata Giveaways,TRUE,TRUE,6496,4872,Approved
SB22586,10722,SB22586 Hul R&D Leadership Forum,TRUE,TRUE,1646729,1235046.75,Approved
SB22587,10723,SB22587 Towards Giveaway Production,TRUE,TRUE,29835,22376.25,Approved
SB22589,10724,SB22589 Amazon - L 7 Recognition,TRUE,TRUE,34100,25575,Approved
SB22590,10725,SB22590 Dell ISG Launch in Pune,TRUE,TRUE,6916000,5187000,Approved
SB22591,10726,SB22591 Dell CSG Launch in Hyderabad,TRUE,TRUE,10725200,8043900,Approved
SB22592,10727,SB22592 Adobe Director Summit,TRUE,TRUE,1456000,1092000,Approved
SB22593,10728,SB22593 Cognizant Client Visit Raheja,TRUE,TRUE,268279,201209.25,Approved
SB22594,10729,SB22594 Siemens 100 years traction: Bharat Mandapam Stall,TRUE,TRUE,1022599,766949.25,Approved
SB22595,10730,SB22595 IKEA - May Activity,TRUE,TRUE,2580160,1935120,Approved
SB22596,10731,SB22596 Red Hat Tech Talk Event Series,TRUE,TRUE,3705921,2779440.75,Approved
SB22597,10732,SB22597 Tvs Shiprocket Recharge,TRUE,TRUE,16125,12093.75,Approved
SB22599,10733,SB22599 SAP Innovation Days,TRUE,TRUE,142703,107027.25,Approved
SB22600,10734,SB22600 Accenture Client event,TRUE,TRUE,192016,144012,Approved
SB22602,10735,SB22602 HUL - B&W JBP Myntra Meet 2025,TRUE,TRUE,1102551,826913.25,Approved
SB22603,10736,SB22603 Siemens Individual PVC card with QR code,TRUE,TRUE,52557,39417.75,Approved
SB22604,10737,SB22604 Amazon rockstars Gurgaon,TRUE,TRUE,1014046,760534.5,Approved
SB22605,10738,SB22605 Intel Premium standee print,TRUE,TRUE,13492,10119,Approved
SB22606,10739,SB22606 TCS W10K 2025,TRUE,TRUE,5907348,4430511,Approved
SB22607,10740,SB22607 ServiceNow Giveaways,TRUE,TRUE,336450,252337.5,Approved
SB22608,10741,SB22608 Siemens Mobility Works,TRUE,TRUE,320000,240000,Approved
SB22609,10742,SB22609 IKEA - April Activity,TRUE,TRUE,713240,534930,Approved
SB22384,11219,SB22384 NTT Data - Transformation NOW,TRUE,TRUE,1805742,1354306.5,Approved
SB22420,11220,SB22420 BIT Mesra 70 Years Platinum Jubilee Celebration,TRUE,TRUE,450000,337500,Approved
SB22422,11221,SB22422 Jubilant Investor Meet 2025,TRUE,TRUE,2500000,1875000,Approved
SB22472,11223,SB22472 Wella Trendvision,TRUE,TRUE,12193500,9145125,Approved
SB22474,11225,SB22474 HPCL Women's Day celebration,TRUE,TRUE,745412,559059,Approved
SB22476,11226,SB22476 Ducati Panigale V4 Launch,TRUE,TRUE,1657975,1243481.25,Approved
SB22485,11227,SB22485 Jamf CIO Summit event,TRUE,TRUE,1236571,927428.25,Approved
SB22509,11228,SB22509 Aircraft launch,TRUE,TRUE,94662,70996.5,Approved
SB22522,11229,SB22522 Maruti Flatbed Requirement,TRUE,TRUE,495845,371883.75,Approved
SB22530,11230,SB22530 Photographer requirement for Sonata Software - Meet,TRUE,TRUE,6000,4500,Approved
SB22531,11231,SB22531 TVS VEHICLE MOBILITY Sign Board,TRUE,TRUE,11000,8250,Approved
SB22579,11232,SB22579 CIO Summit event,TRUE,TRUE,659496,494622,Approved
SB22588,11233,SB22588 Superhealth Hospital Branding,TRUE,TRUE,451386,338539.5,Approved
SB22601,11234,SB22601 Proposal for Novo Nordisk Q1 Digest,TRUE,TRUE,72600,54450,Approved
SB21386,11423,SB21386 Accenture  FE Utsava - Carnival Artists,TRUE,TRUE,400000,0,Approved
SB21718,11424,SB21718 Google YouTube Creator Collective Q3 2024,TRUE,TRUE,49063401,17667663,Approved
SB21768,11425,SB21768 HUL Finomenals 2024,TRUE,TRUE,2550462,1045400,Approved
SB21825,11426,SB21825 Audi 100 K Milestone Celebration Event,TRUE,TRUE,29512410,18212320,Approved
SB22598,11427,SB22598 KNMA WithIn by Aditi Mangaldas,TRUE,TRUE,1150000,862500,Approved
SB22610,11428,SB22610 Amazon Whiteboard Animation video project,TRUE,TRUE,71500,53625,Approved
SB22612,11429,SB22612 Greenlam GT Launch,TRUE,TRUE,2099625,1574718.75,Approved
SB22613,11430,SB22613 VinFast Digital Promotions,TRUE,TRUE,6873000,5154750,Approved
SB22614,11431,SB22614 Tally Mahasabha 2025,TRUE,TRUE,5079584,3809688,Approved
SB22615,11432,SB22615 Kia Clavis Hybrid,TRUE,TRUE,23940532,17955399,Approved
SB22616,11433,SB22616  HDFC Bank Tech Workshop HYD,TRUE,TRUE,617954,463465.5,Approved
SB22617,11434,SB22617 Cognizant NW visit,TRUE,TRUE,205700,154275,Approved
SB22618,11435,SB22618 Hyundai Global Service Seminar 2025,TRUE,TRUE,3522570,2641927.5,Approved
SB22619,11436,SB22619 Siemens - HR Offiste 2025,TRUE,TRUE,839248,629436,Approved
SB22620,11437,SB22620 Palo Cybersecurity Leadership Summitt,TRUE,TRUE,15498045,11623533.75,Approved
SB22622,11438,SB22622 Townhall at Microsoft,TRUE,TRUE,437265,327948.75,Approved
SB22623,11439,SB22623 HPE Zerto Enablement,TRUE,TRUE,1719960,1289970,Approved
SB22624,11440,SB22624 Phone Pe - Converge,TRUE,TRUE,703084,527313,Approved
SB22625,11441,SB22625 GBS Finance Offsite ,TRUE,TRUE,30800,23100,Approved
SB22626,11442,SB22626 Adobe Elite Circle,TRUE,TRUE,1800000,1350000,Approved
SB22627,11443,SB22627 Natwest Nasscom GCC Summit 2025,TRUE,TRUE,361880,271410,Approved
SB22628,11444,SB22628 Red ABM Account Day,TRUE,TRUE,822404,616803,Approved
SB22629,11445,SB22629 STT Advantage Employee offsite,TRUE,TRUE,11232890,8424667.5,Approved
SB22630,11446,SB22630 Adobe Partner Summit hotel,TRUE,TRUE,1500000,1125000,Approved
SB22631,11447,SB22631 Red Hat BFSI Summit,TRUE,TRUE,4847633,3635724.75,Approved
SB22632,11448,"SB22632 Accenture stall @ NASSCOM GCC Summit,",TRUE,TRUE,553080,414810,Approved
SB22633,11449,SB22633 Cognizant - Client Visit,TRUE,TRUE,25300,18975,Approved
SB22634,11450,SB22634 Red Hat Immersion Day - Mumbai | Q2,TRUE,TRUE,870929,653196.75,Approved
SB22635,11451,SB22635 Amazon BOX Installation,TRUE,TRUE,163200,122400,Approved
SB22636,11452,SB22636 Walmart Townhall,TRUE,TRUE,535700,401775,Approved
SB22637,11453,SB22637 Natwest Ruchika Town Hall Meet,TRUE,TRUE,349765,262323.75,Approved
SB22638,11454,SB22638 Red Hat F & B,TRUE,TRUE,46575,34931.25,Approved
SB22639,11455,SB22639 BROOKFIELD DC VS RCB IPL,TRUE,TRUE,440000,330000,Approved
SB22640,11456,SB22640 YTCC X-Waves,TRUE,TRUE,12600000,9450000,Approved
SB22641,11457,SB22641 Siemens GBS SSON Visit,TRUE,TRUE,115000,86250,Approved
SB22642,11458,SB22642 Amazon Townhall event,TRUE,TRUE,80014,60010.5,Approved
SB22643,11459,SB22643 AI@Walmart,TRUE,TRUE,1784284,1338213,Approved
SB22644,11460,SB22644 Intel - Webinr Series for Audience Acquasition,TRUE,TRUE,861000,645750,Approved
SB22645,11461,"SB22645 Hul Shiva's Farewell Event,",TRUE,TRUE,1783762,1337821.5,Approved
SB22646,11462,SB22646 Hero Farwell event,TRUE,TRUE,1146015,859511.25,Approved
SB22648,11463,SB22648 Mahindra Press & Analyst Meet,TRUE,TRUE,792000,594000,Approved
SB22649,11464,SB22649 Cognizant Zumba activity,TRUE,TRUE,100100,75075,Approved
SB22650,11465,SB22650 Kotak Townhall with CEO,TRUE,TRUE,1478362,1108771.5,Approved
SB22651,11466,SB22651 Amazon IN Finance Career Day 2025,TRUE,TRUE,437059,327794.25,Approved
SB22652,11467,SB22652 Amazon collateral design and print,TRUE,TRUE,10010,7507.5,Approved
SB22653,11468,SB22653 SS Plate _SEIL Name Plates,TRUE,TRUE,376776,282582,Approved
SB22654,11469,SB22654 Amazon Transcend Graduation,TRUE,TRUE,209293,156969.75,Approved
SB22655,11470,SB22655 Red ACE Program - Aditya Birla Group,TRUE,TRUE,823500,617625,Approved
SB22656,11471,SB22656 OnePlus Masterclass,TRUE,TRUE,725537,544152.75,Approved
SB22657,11472,SB22657 Google YT Shopping Lifestyle edition,TRUE,TRUE,8200000,6150000,Approved
SB22658,11473,SB22658 Red Hat Immersion Day,TRUE,TRUE,453325,339993.75,Approved
SB22659,11474,SB22659 Amazon Day One at Work,TRUE,TRUE,178178,133633.5,Approved
SB22660,11475,SB22660 HUL iSight App Showcase,TRUE,TRUE,141052,105789,Approved
SB22661,11476,SB22661 Takasago Food solution centre Inauguration,TRUE,TRUE,526900,395175,Approved
SB22662,11477,SB22662 Tata Fleet Management at Waves,TRUE,TRUE,4041600,3031200,Approved
SB22664,11478,SB22664 Amway BBS Multicity events,TRUE,TRUE,4000000,3000000,Approved
SB22665,11479,SB22665 CIO KERALA CHAPTER,TRUE,TRUE,511803,383852.25,Approved
SB22666,11480,SB22666 HPE Aruba CXO Meet,TRUE,TRUE,1947000,1460250,Approved
SB22668,11481,SB22668 Brookprop WATERSTONES,TRUE,TRUE,1690063,1267547.25,Approved
SB22663,11482,SB22663 Siemens Canteen Inauguration Event,TRUE,TRUE,270874.93,203156.2,Approved
SB21992,11623,SB21992 Meeting Expenses,TRUE,TRUE,1000000,0,Approved
SB22647,11624,SB22647 Indo IFCCI Seminar. ,TRUE,TRUE,97440,73080,Approved
SB22667,11625,SB22667 40th Year Anniversary,TRUE,TRUE,148005,111003.75,Approved
SB22611,11626,SB22611 Bumblebee Fun Activities,TRUE,TRUE,381205,285903.75,Approved
SB22621,11627,SB22621 Towards T-shirts with branding - Partner Kick Off,TRUE,TRUE,198375,148781.25,Approved
